{"generated_at":"2026-09-09T13:47:38Z","hosted_ci":{"run":{"path":"716454def777a4e17e8aa6ced6a79421dae6dfec627215561343438dab3507c5-hosted-run-verifiable.json","sha256":"716454def777a4e17e8aa6ced6a79421dae6dfec627215561343438dab3507c5","size_bytes":3162}},"icc":{"index":{"path":"icc-codebase-index.json","sha256":"e25bac1b28bbf698be1c2acdfc95e431fcceab97eee242afcba7f7e1b572615a","size_bytes":61256039},"source_drift":{"path":"6831e92a65e2eb925dcd629ac56ab03805cfeffbe9301fe8cfcb417d9e561086-icc-cert-drift-export.json","sha256":"6831e92a65e2eb925dcd629ac56ab03805cfeffbe9301fe8cfcb417d9e561086","size_bytes":3311}},"mesh":{"artifacts":[{"file":{"path":"851f4ec9a6c7e091aa9f9a04200514316e0ac96196e5f6a6d108225c4a9e3238-moonlab-source.tar","sha256":"851f4ec9a6c7e091aa9f9a04200514316e0ac96196e5f6a6d108225c4a9e3238","size_bytes":37437440},"name":"source-archive"},{"file":{"path":"7d0995ea21f49a4c27c0884bfcf3980ccc5ddc83263c456ef8ac2a7acf04345a-raw-original-artifact_manifest.json","sha256":"7d0995ea21f49a4c27c0884bfcf3980ccc5ddc83263c456ef8ac2a7acf04345a","size_bytes":2112},"name":"raw-original-manifest"},{"file":{"path":"0e141f46c912c598bb3fa72e118ab3b02e5b0384e890fd29969880f7300f9d50-raw-enki-retry-artifact_manifest.json","sha256":"0e141f46c912c598bb3fa72e118ab3b02e5b0384e890fd29969880f7300f9d50","size_bytes":881},"name":"raw-enki-retry-manifest"},{"file":{"path":"44f0fe4328c9bf05c83da56819edeed8a68970a70cb2e3655cfe89f3ac202053-atlas.smoke.log","sha256":"44f0fe4328c9bf05c83da56819edeed8a68970a70cb2e3655cfe89f3ac202053","size_bytes":87072},"name":"atlas-selected-log"},{"file":{"path":"b2931e0e82d2f71c3b945b09b5ce0fa86010751a5e48f5eb486dd167b0911f9a-enki.smoke.log","sha256":"b2931e0e82d2f71c3b945b09b5ce0fa86010751a5e48f5eb486dd167b0911f9a","size_bytes":83124},"name":"enki-selected-log"},{"file":{"path":"faaabd84c8b57b767231992ed54c45b6ced0dde4c27b8ca1be037c63d9a1568a-xavier.smoke.log","sha256":"faaabd84c8b57b767231992ed54c45b6ced0dde4c27b8ca1be037c63d9a1568a","size_bytes":59939},"name":"xavier-selected-log"},{"file":{"path":"0290532d09cf45e5708f52d4e19943a2ff18a43dc80392c37692724c0cdd8940-cosbox.smoke.log","sha256":"0290532d09cf45e5708f52d4e19943a2ff18a43dc80392c37692724c0cdd8940","size_bytes":52428},"name":"cosbox-selected-log"},{"file":{"path":"2bddce6b35a19276dfade5803e28c874ef5abc0324311626c7c68020e5c63105-old-donkey.smoke.log","sha256":"2bddce6b35a19276dfade5803e28c874ef5abc0324311626c7c68020e5c63105","size_bytes":58578},"name":"old-donkey-selected-log"}],"manifest":{"path":"d7859960143aab3e3bc323eb5f29c4f6570eb331541a6339e5ae320bd0e255b5-aggregate-manifest.json","sha256":"d7859960143aab3e3bc323eb5f29c4f6570eb331541a6339e5ae320bd0e255b5","size_bytes":1180},"node_ids":["atlas","enki","xavier","cosbox","old-donkey"],"nodes_passed":5,"nodes_total":5,"source":{"dirty":false,"git_head":"a15dabcf79a93b195ed062c6ed338cb4bc2c733b","git_tree":"1ab872e09bcc829e72e633b4115c9326fc27b358","source_fingerprint":"eb3448c78fa4c1a07c96d338e9f8dfc95c27f55f33625a6ba4f262a4a7b9fbbb"},"status":"PASS"},"portability":{"aggregate":{"path":"b4b98f72fbaf567cac098d738eced7d85866b367636b48b8fb9a122c13b5e32f-moonlab-linux-portability-aggregate.json","sha256":"b4b98f72fbaf567cac098d738eced7d85866b367636b48b8fb9a122c13b5e32f","size_bytes":15222},"bundles":[{"file":{"path":"465e602765eeffea6b34677576bb9a2f87b0ff8b24fcb27fa5414411fd0247a5-moonlab-linux-portability-lane-debian-12-amd64.tar.gz","sha256":"465e602765eeffea6b34677576bb9a2f87b0ff8b24fcb27fa5414411fd0247a5","size_bytes":2744431},"profile_id":"debian-12-amd64"},{"file":{"path":"6a6b42f42fa7a56446a310f13feb7cf92219def86c5cd0e4efd067e853a95da9-moonlab-linux-portability-lane-debian-12-arm64.tar.gz","sha256":"6a6b42f42fa7a56446a310f13feb7cf92219def86c5cd0e4efd067e853a95da9","size_bytes":2665973},"profile_id":"debian-12-arm64"},{"file":{"path":"1b5861bbb11167e0b7b27b6eb1c9904e209f7f9fe870868a6fb5e9dc2efdc2a1-moonlab-linux-portability-lane-debian-13-amd64.tar.gz","sha256":"1b5861bbb11167e0b7b27b6eb1c9904e209f7f9fe870868a6fb5e9dc2efdc2a1","size_bytes":2767557},"profile_id":"debian-13-amd64"},{"file":{"path":"4f879941875bdf870c5c80aecdaf890ac12381bb36314a73806ac7951e52225b-moonlab-linux-portability-lane-debian-13-arm64.tar.gz","sha256":"4f879941875bdf870c5c80aecdaf890ac12381bb36314a73806ac7951e52225b","size_bytes":2713664},"profile_id":"debian-13-arm64"},{"file":{"path":"f594d29f88a3a29e17c39a33fdf7db1391ce5e4e42d97e4db279937f50467f86-moonlab-linux-portability-lane-ubuntu-22.04-amd64.tar.gz","sha256":"f594d29f88a3a29e17c39a33fdf7db1391ce5e4e42d97e4db279937f50467f86","size_bytes":2728513},"profile_id":"ubuntu-22.04-amd64"},{"file":{"path":"7a6f5f618f1f8faa9f94e7827b901adce92b8c9f310afcf0f07438167d2ec3bc-moonlab-linux-portability-lane-ubuntu-22.04-arm64.tar.gz","sha256":"7a6f5f618f1f8faa9f94e7827b901adce92b8c9f310afcf0f07438167d2ec3bc","size_bytes":2648761},"profile_id":"ubuntu-22.04-arm64"},{"file":{"path":"063e761816a061868efc33c908ca113be78a711c4a8c93ced11e83c61b38259d-moonlab-linux-portability-lane-ubuntu-24.04-amd64.tar.gz","sha256":"063e761816a061868efc33c908ca113be78a711c4a8c93ced11e83c61b38259d","size_bytes":2764297},"profile_id":"ubuntu-24.04-amd64"},{"file":{"path":"4542dce6443cd0eb8cfce36fa1e8553cf2eb7e24857adc1a9923b98385fecbf2-moonlab-linux-portability-lane-ubuntu-24.04-arm64.tar.gz","sha256":"4542dce6443cd0eb8cfce36fa1e8553cf2eb7e24857adc1a9923b98385fecbf2","size_bytes":2714611},"profile_id":"ubuntu-24.04-arm64"},{"file":{"path":"c62728c05a83fda8401e722b14a53d9c962f688803f3950cfe7ef92e07f26dff-moonlab-linux-portability-lane-ubuntu-26.04-amd64.tar.gz","sha256":"c62728c05a83fda8401e722b14a53d9c962f688803f3950cfe7ef92e07f26dff","size_bytes":2768608},"profile_id":"ubuntu-26.04-amd64"},{"file":{"path":"9b56935a8b51c07cb8e0788c7ab8de159533248a33c4168730d17dcd729bf2aa-moonlab-linux-portability-lane-ubuntu-26.04-arm64.tar.gz","sha256":"9b56935a8b51c07cb8e0788c7ab8de159533248a33c4168730d17dcd729bf2aa","size_bytes":2806630},"profile_id":"ubuntu-26.04-arm64"}]},"release_artifacts":[{"file":{"path":"moonlab_1.2.1_amd64.deb","sha256":"f223be69347b1fa5746a6b674a4da7d66a40c878977dd6c77c4876c71f3caa0d","size_bytes":1144096},"kind":"debian-amd64","package":"debian","platform":"linux-amd64","version":"1.2.1"},{"file":{"path":"moonlab_1.2.1_arm64.deb","sha256":"a1276fdd1332a3d5bea712e3326acf8148346b4692c333b9bedd4f817d903207","size_bytes":1132632},"kind":"debian-arm64","package":"debian","platform":"linux-arm64","version":"1.2.1"},{"file":{"path":"moonlab-v1.2.1-linux-arm64.tar.gz","sha256":"9e72fc53a7bfae08fe5ef56756675d830872b1b5b2517ab22ddc64affd6963aa","size_bytes":1357217},"kind":"native-linux-arm64","package":"native","platform":"linux-arm64","version":"1.2.1"},{"file":{"path":"moonlab-v1.2.1-linux-x64.tar.gz","sha256":"3df55f512ad7cbfba00e99b25cb0bf7a45a1c5ecf658de91f4cba6d737798ba3","size_bytes":1365823},"kind":"native-linux-x64","package":"native","platform":"linux-x64","version":"1.2.1"},{"file":{"path":"moonlab-v1.2.1-macos-arm64.tar.gz","sha256":"beb9de15579a3981891dfbcee90a17ead5e7a1d98573cf1d9b254f789c6ec106","size_bytes":1253785},"kind":"native-macos-arm64","package":"native","platform":"macos-arm64","version":"1.2.1"},{"file":{"path":"moonlab-v1.2.1-macos-x64.tar.gz","sha256":"4053ea0d6e4243290e4bd6973554a212df83f64118b0f888ac2aed24892a4d50","size_bytes":1360385},"kind":"native-macos-x64","package":"native","platform":"macos-x64","version":"1.2.1"},{"file":{"path":"moonlab-v1.2.1-windows-arm64.zip","sha256":"8709bf39aff9a8c1617fcfa75989b5442592046fd137f13f59f9ab8077a889c1","size_bytes":1184955},"kind":"native-windows-arm64","package":"native","platform":"windows-arm64","version":"1.2.1"},{"file":{"path":"moonlab-v1.2.1-windows-x64.zip","sha256":"9a30717065b6c87a2e52c0de2a507436cb631fb4b463e2d466fc68c12804590d","size_bytes":1242276},"kind":"native-windows-x64","package":"native","platform":"windows-x64","version":"1.2.1"},{"file":{"path":"tsotchkecorp-moonlab-algorithms-1.2.1.tgz","sha256":"13bfc5768e9ebc657539b38748d02d0ee4e4be9d7fc4577929f2a21f51a72819","size_bytes":5059},"kind":"npm-algorithms","package":"@tsotchkecorp/moonlab-algorithms","platform":"source","version":"1.2.1"},{"file":{"path":"tsotchkecorp-moonlab-1.2.1.tgz","sha256":"706f91b01f94867e0198235ae5f2ebec098cc1d271a3aa68c6ecf25b4669ce36","size_bytes":917650},"kind":"npm-core","package":"@tsotchkecorp/moonlab","platform":"source","version":"1.2.1"},{"file":{"path":"tsotchkecorp-moonlab-react-1.2.1.tgz","sha256":"d5c261d7ae4126f7d3cdc785d6def02839e179e57e58899e406d4148bc0734d9","size_bytes":7496},"kind":"npm-react","package":"@tsotchkecorp/moonlab-react","platform":"source","version":"1.2.1"},{"file":{"path":"tsotchkecorp-moonlab-viz-1.2.1.tgz","sha256":"9787e4297bea8d286af35cafab4828e08507e1e691fda0e9869fd9ab72c00c9d","size_bytes":37346},"kind":"npm-viz","package":"@tsotchkecorp/moonlab-viz","platform":"source","version":"1.2.1"},{"file":{"path":"tsotchkecorp-moonlab-vue-1.2.1.tgz","sha256":"452b4c0a64fe6096262c4d1a80c419f2173e48444243220b4d35d9dd4733b697","size_bytes":8088},"kind":"npm-vue","package":"@tsotchkecorp/moonlab-vue","platform":"source","version":"1.2.1"},{"file":{"path":"moonlab-1.2.1.crate","sha256":"8642d78a5641fd53e3bbed5afecdc1d2e23611014338090305d6c8e3d19e8bdd","size_bytes":108910},"kind":"rust-moonlab","package":"moonlab","platform":"source","version":"1.2.1"},{"file":{"path":"moonlab-sys-1.2.1.crate","sha256":"89e6574e1fdde8954e7b74439490bb3aa5cb7eca22cb5353c9861ffa71a904de","size_bytes":12861},"kind":"rust-moonlab-sys","package":"moonlab-sys","platform":"source","version":"1.2.1"},{"file":{"path":"moonlab-tui-1.2.1.crate","sha256":"1e0e9e84eabfc344b6d867e617908428bbf044534bb21567839cab04fba2f242","size_bytes":41974},"kind":"rust-moonlab-tui","package":"moonlab-tui","platform":"source","version":"1.2.1"},{"file":{"path":"moonlab-1.2.1-py3-none-manylinux_2_27_aarch64.manylinux_2_28_aarch64.whl","sha256":"4efb8e82952ac0e4e1c4db5ee128d6bb734980fe5e449c55684410d4ce97a967","size_bytes":10049702},"kind":"wheel-lin